{
    "$schema": "http://json-schema.org/draft-07/schema#",
    "type": "array",
    "items": {
        "type": "object",
        "properties": {
            "type": { "type": "string" },
            "module": { "type": "string" },
            "obj": { "type": "string" },
            "line": { "type": "integer" },
            "column": { "type": "integer" },
            "endLine": { "type": ["integer", "null"] },
            "endColumn": { "type": ["integer", "null"] },
            "path": { "type": "string" },
            "symbol": { "type": "string" },
            "message": { "type": "string" },
            "message-id": { "type": "string" }
        },
        "required": ["type", "module", "obj", "line", "column", "path", "symbol", "message", "message-id"],
        "additionalProperties": false
    }
}
